NCTId,BriefTitle,OfficialTitle,OverallStatus,Phase,StudyType,EnrollmentCount,Conditions,InterventionNames,InterventionTypes,StartDate,PrimaryCompletionDate,CompletionDate,Countries,LeadSponsor,PrimaryOutcome,BriefSummary,MatchedTargets
NCT05467202,Evaluate the Safety and Efficacy of CLL1 CAR-T in Patients With R/R AML,To Evaluate the Safety and Efficacy of CLL1 CAR-T in Patients With Relapsed and Refractory Acute Myeloid Leukemia,UNKNOWN,PHASE1,INTERVENTIONAL,20,AML,CLL1 CAR-T,DRUG,2022-08-01,2024-08-02,2025-08-02,China,Zhejiang University,Evaluation of Safety; Changes in cytokine level after CLL1 CAR-T infusion,"This is an open label, phase I study to assess the safety and efficacy of CLL1 CAR-T in patients with relapsed and refractory acute myeloid leukemia",CLL-1
NCT06110208,Study to Evaluate the Safety and Preliminary Efficacy of CLL1 and CD38 Dual CAR-T in r/r AML,Clinical Study to Evaluate the Safety and Preliminary Efficacy of CLL1 and CD38 Dual CAR-T Injection in the Treatment of Relapsed and Refractory Acute Myeloid Leukemia,TERMINATED,EARLY_PHASE1,INTERVENTIONAL,3,Acute Myeloid Leukemia,CLL1 and CD38 dual-target CAR-T injection,DRUG,2023-10-10,2024-07-01,2024-07-01,China,920th Hospital of Joint Logistics Support Force of People's Liberation Army of China,Dose limited toxicity (DLT);; Adverse events (AE),This study is a single-center clinical study. The main purpose is an IIT clinical trial to evaluate the safety and preliminary efficacy of CLL1 and CD38 dual CAR-T injection in r/r AML subjects . The included population were patients with relapsed and refractory acute myeloid leukemia (r/r AML) .,CLL-1; CD38
NCT04884984,Anti-CLL1 CAR T-cell Therapy in CLL1 Positive Relapsed/Refractory Acute Myeloid Leukemia (AML),Pilot Study of the Safety and Efficacy of Anti-CLL1 Chimeric Antigen Receptor Engineered T-Cells in the Treatment of CLL1 Positive Relapsed or Refractory Acute Myeloid Leukemia (AML),UNKNOWN,"PHASE1, PHASE2",INTERVENTIONAL,20,Acute Myeloid Leukemia,anti-CLL1 CART,BIOLOGICAL,2017-07-01,2022-12-31,2024-12-31,China,The First Affiliated Hospital of Soochow University,Number of Adverse Events,"This is a single center, open-label phase 1/2 study to evaluate the safety and efficacy of anti-CLL1 chimeric antigen receptor engineered T cell immunotherapy (CART) in the treatment of CLL1 positive relapsed or refractory acute myeloid leukemia.",CLL-1
NCT06680752,Clinical Study of ARD103 CAR-T Therapy for Patients With R/R AML or MDS,"A Phase 1/2, Open-label, Multicenter Trial to Assess the Safety and Efficacy of ARD103 in Patients With Relapsed or Refractory Acute Myeloid Leukemia or Myelodysplastic Syndrome",RECRUITING,"PHASE1, PHASE2",INTERVENTIONAL,49,"Acute Myeloid Leukemia, in Relapse; Acute Myeloid Leukemia Refractory; MDS (Myelodysplastic Syndrome)",ARD103; Cyclophosphamide; Fludarabine,BIOLOGICAL; DRUG; DRUG,2025-05-20,2028-10,2028-12,United States,"ARCE Therapeutics, Inc.",Incidence of Treatment-Emergent Adverse Events [Safety and Tolerability]; To determine the RP2D of ARD103; To evaluate overall response rate (ORR),"This is a phase I/2, interventional, open-label, multicenter study to assess the safety and efficacy of ARD103 in patients with relapsed or refractory acute myeloid leukemia or myelodysplastic syndrome.",CLL-1
NCT07338357,Clinical Study of CLL-1 CAR-T in the Treatment of Children With R/R AML,A Single-Center Clinical Study Evaluating the Safety and Preliminary Efficacy of CLL-1 CAR-T in the Treatment of Children With Relapsed/Refractory Acute Myeloid Leukemia,NOT_YET_RECRUITING,EARLY_PHASE1,INTERVENTIONAL,10,AML (Acute Myeloid Leukemia); CAR-T,CAR-T,BIOLOGICAL,2026-01-05,2028-10-31,2028-10-31,,First Affiliated Hospital of Guangxi Medical University,Incidence of Treatment-Related Adverse Events,A study to evaluate the safety and preliminary efficacy of CLL-1-targeted CAR-T cell therapy in children aged 3 to 18 years with relapsed or refractory acute myeloid leukemia (r/r AML).,CLL-1
NCT06307054,CLL-1 CAR-NK Cells for Relapsed/Refractory AML,The Safety and Efficacy for Anti-human CLL-1 CAR-NK Cells in Subjects With Relapsed/Refractory Acute Myeloid Leukemia,RECRUITING,PHASE1,INTERVENTIONAL,24,Relapsed Adult AML; Refractory AML,anti-CLL-1 CAR NK cells,DRUG,2024-04-01,2026-03-15,2027-03-15,China,"Shanghai General Hospital, Shanghai Jiao Tong University School of Medicine",AE; DLT,"This study is a single-arm, open-label, dose-escalation clinical trial aimed at exploring the safety, tolerability, and pharmacokinetic characteristics of the CLL-1 CAR NK cells, as well as providing preliminary observations on its efficacy in subjects with relapsed/refractory acute myeloid leukemia.",CLL-1
NCT07036250,Clinical Study of U32 in Patients With Acute Myeloid Leukemia,"A Single-arm, Open-label Clinical Study to Evaluate the Safety, Tolerability, and Efficacy of U32 Injection in Patients With Acute Myeloid Leukemia.",RECRUITING,"PHASE1, PHASE2",INTERVENTIONAL,20,Acute Myeloid Leukaemia,U32 CAR-T,DRUG,2025-07-03,2027-12-31,2029-12-31,China,"Shanghai Unicar-Therapy Bio-medicine Technology Co.,Ltd",Incidence of Adverse events after U32CAR-T cells infusion [Safety and Tolerability],"This is a single-arm, open-label clinical study to evaluate the safety, tolerability, and efficacy of U32 injection in patients with acute myeloid leukemia.",CLL-1; CD38
NCT06118788,Phase I Clinical Study: BG1805 Injection in the Treatment of Relapsed or Refractory Acute Myeloid Leukemia,"A Single-arm, Dose-escalation and Dose-expansion Phase I Clinical Study to Evaluate the Tolerability, Safety and Preliminary Efficacy of BG1805 Injection in the Treatment of Relapsed or Refractory Acute Myeloid Leukemia",RECRUITING,"PHASE1, PHASE2",INTERVENTIONAL,24,"Leukemia, Myeloid, Acute",BG1805,BIOLOGICAL,2024-03-07,2027-03,2027-07,China,"Guangzhou Bio-gene Technology Co., Ltd",Dose Limited Toxicity Rate; Incidence of Treatment-Emergent Adverse Events,"This is a single-arm, single-dose dose-escalation and dose-expansion study.",CLL-1
NCT04923919,Clinical Study of Chimeric Antigen Receptor T Lymphocytes (CAR-T) in the Treatment of Myeloid Leukemia,Clinical Study of Chimeric Antigen Receptor T Lymphocytes (CAR-T) in the Treatment of Myeloid Leukemia,UNKNOWN,EARLY_PHASE1,INTERVENTIONAL,100,Acute Myeloid Leukemia,Anti-CLL1 CART cells,DRUG,2021-09-14,2024-12-05,2024-12-05,China,920th Hospital of Joint Logistics Support Force of People's Liberation Army of China,Incidence of AE after CAR-T infusion,"Researchers plan to enroll a total of 100 patients with relapsed, refractory acute myeloid leukemia (AML) to receive a single dose of autologous CAR T cells.The safety of CAR T therapy was evaluated by observing adverse events after cell therapy;The efficacy of CAR-T therapy was evaluated against the outcome of patients' own past standard treatment regimens or historical data.Blood and bone marrow were collected before and 12 months after infusion to detect the number and activity of CAR T cells, and to evaluate the pharmacokinetics (PK) of CAR T cells.",CLL-1
NCT05239689,Clinical Study of CD38 CAR-T Cells in the Treatment of Hematological Malignancies,Clinical Study on the Safety and Effectiveness of CD38 CAR-T Cells in the Treatment of CD38-positive Hematological Malignancies,UNKNOWN,EARLY_PHASE1,INTERVENTIONAL,36,AML,CD38 CAR T-cells,BIOLOGICAL,2022-02-28,2024-12-05,2024-12-05,China,Zhejiang University,Dose-limiting toxicity (DLT); Incidence of treatment-emergent adverse events (TEAEs),Clinical Study on the Safety and Effectiveness of CD38 CAR-T Cells in the Treatment of CD38-positive Hematological Malignancies,CD38
NCT05442580,CART-38 in Adult AML and MM Patients,Phase 1 Study of Lintivirally Transduced T Cells Engineered to Contain Anti-CD38 Linked to TCRζ and 4-1BB Signaling Domains in Subjects With Acute Myeloid Leukemia and Multiple Myeloma,TERMINATED,PHASE1,INTERVENTIONAL,11,Acute Myeloid Leukemia (AML); Multiple Myeloma (MM),3x10(6) CART-38 cellls; 7x10(5) CART-38 cells; 7x10(6) CART-38 cells; 3x10(7) CART-38 cells; Cyclophosphamide; Fludarabine,DRUG; DRUG; DRUG; DRUG; DRUG; DRUG,2023-05-30,2025-02-09,2025-02-09,United States,University of Pennsylvania,Number of Subjects with treatment related adverse events using NCI Common Terminology Criteria for Adverse Events (CTCAE) V5.0; Number of subjects with dose-limiting toxicities; Determination of maximum tolerated dose assessed by collection of adverse events as graded by CTCAE.,"This is an open-label Phase 1 study to estimate the safety and manufacturing feasibility of lentivirally transduced T cells expressing anti-CD38 chimeric antigen receptors expressing tandem TCRζ and 4-1BB (TCRζ /4-1BB) costimulatory domains in patients with Acute Myeloid Leukemia and Multiple Myeloma. This CAR T cell product will be referred to as ""CART-38 cells"".",CD38
NCT04762485,Humanized CD7 CAR T-cell Therapy for r/r CD7+ Acute Leukemia,Humanized Chimeric Antigen Receptor T Cells Against CD7 for Refractory/Relapsed CD7+ Acute Leukemia,UNKNOWN,"PHASE1, PHASE2",INTERVENTIONAL,20,T Lymphoblastic Leukemia/Lymphoma; Mixed Phenotype Acute Leukemia; Acute Myeloid Leukemia,Humanized CD7 CAR-T cells,BIOLOGICAL,2021-06-01,2023-02-28,2024-02-28,China,The First Affiliated Hospital of Soochow University,Number of Adverse Events,"This is a prospective,open-label, single center and single arm phase 1/2 study to evaluate the efficacy and safety of T cells expressing humanized CD7 chimeric antigen receptors treatment for patients with refractory/relapsed CD7 positive acute leukemia.",CD38
NCT04351022,CD38-targeted Chimeric Antigen Receptor T Cell (CART) in Relapesd or Refractory Acute Myeloid Leukemia,Pilot Study of the Efficacy and Safety of CD38 Targeted Chimeric Antigen Receptor Engineered T-Cells in the Treatment of CD38 Positive Relapsed or Refractory Acute Myeloid Leukemia (AML),UNKNOWN,"PHASE1, PHASE2",INTERVENTIONAL,20,Acute Myeloid Leukemia,CART-38,BIOLOGICAL,2017-07-01,2021-12-31,2023-12-31,China,The First Affiliated Hospital of Soochow University,Number of Adverse Events,"This is a single center, open-label phase 1/2 study to evaluate the safety and efficacy of targeted CD38 chimeric antigen receptor engineered T cell immunotherapy (CART) in the treatment of CD38 positive relapsed or refractory acute myeloid leukemia.",CD38
