NCTId,BriefTitle,OfficialTitle,OverallStatus,Phase,StudyType,EnrollmentCount,Conditions,InterventionNames,InterventionTypes,StartDate,PrimaryCompletionDate,CompletionDate,Countries,LeadSponsor,PrimaryOutcome,BriefSummary,MatchedTargets
NCT03672851,Study Evaluating Safety and Efficacy of CAR-T Cells Targeting CD123 in Patients With Acute Leukemia,Study Evaluating Safety and Efficacy of CAR-T Cells Targeting CD123 in Patients With Acute Leukemia,TERMINATED,PHASE1,INTERVENTIONAL,2,Acute Leukemia; Acute Leukemia in Relapse; Acute Myeloid Leukemia; Relapsed or Refractory Acute Leukemia,anti-CD123 CAR-T treatment,DRUG,2019-04-17,2019-07-31,2019-07-31,China,Second Affiliated Hospital of Xi'an Jiaotong University,Dose-limiting toxicity (DLT); Incidence of adverse events; Disease response (CR or CRi),"This is a single arm, open-label, phase 1 study, to determine the safety and efficacy of anti-CD123 CAR-T cells in treating patients diagnosed with refractory/relapsed acute leukemia in a dose-escalation way.",CD123
NCT02159495,Genetically Modified T-cell Immunotherapy in Treating Patients With Relapsed/Refractory Acute Myeloid Leukemia and Persistent/Recurrent Blastic Plasmacytoid Dendritic Cell Neoplasm,"Phase I Study of Cellular Immunotherapy Using T Cells Lentivirally Transduced to Express a CD123-Specific, Hinge-Optimized, CD28-Costimulatory Chimeric Antigen Receptor and a Truncated EGFR for Patients With CD123+ Relapsed/Refractory Acute Myeloid Leukemia and Persistent/Recurrent Blastic Plasmacytoid Dendritic Cell Neoplasm",ACTIVE_NOT_RECRUITING,PHASE1,INTERVENTIONAL,31,Adult Acute Myeloid Leukemia in Remission; Acute Biphenotypic Leukemia; Early Relapse of Acute Myeloid Leukemia; Late Relapse of Acute Myeloid Leukemia; Recurrent Adult Acute Myeloid Leukemia; Secondary Acute Myeloid Leukemia; Blastic Plasmacytoid Dendritic Cell Neoplasm; Acute Myeloid Leukemia; Adult Acute Lymphoblastic Leukemia; Interleukin-3 Receptor Subunit Alpha Positive; Minimal Residual Disease; Refractory Acute Myeloid Leukemia; Untreated Adult Acute Myeloid Leukemia,cyclophosphamide; Autologous CD123CAR-CD28-CD3zeta-EGFRt-expressing T Lymphocytes; laboratory biomarker analysis; Allogeneic CD123CAR-CD28-CD3zeta-EGFRt-expressing T-lymphocytes; Fludarabine Phosphate,DRUG; BIOLOGICAL; OTHER; BIOLOGICAL; DRUG,2015-12-15,2026-08-06,2026-08-06,United States,City of Hope Medical Center,Dose-limiting toxicity (DLT) defined as any grade 3 or higher toxicity as assessed by the National Cancer Institute (NCI) Common Terminology Criteria for Adverse Events (CTCAE) version 4.0; Incidence of adverse events as assessed by NCI CTCAE version 4.0; Disease response (CR or CRi),This phase I trial studies the side effects and the best dose of genetically modified T-cells after lymphodepleting chemotherapy in treating patients with acute myeloid leukemia or blastic plasmacytoid dendritic cell neoplasm that has returned after a period of improvement or has not responded to previous treatment. An immune cell is a type of blood cell that can recognize and kill abnormal cells in the body. The immune cell product will be made from patient or patient's donor (related or unrelated) blood cells. The immune cells are changed by inserting additional pieces of deoxyribonucleic ac,CD123
NCT05513612,Novel CAR-T Cell Therapy in the Treatment of Hematopoietic and Lymphoid Malignancies,Safety and Efficacy Study of Novel CAR-T Cell Therapy in the Treatment of Hematopoietic and Lymphoid Malignancies,WITHDRAWN,PHASE1,INTERVENTIONAL,0,"Acute Myeloid Leukemia (AML); B-cell Non-Hodgkin's Lymphoma (B-NHL); Multiple Myeloma (MM); T-Cell Leukemia/Lymphoma, Adult; B-cell Acute Lymphoblastic Leukemia (B-ALL)",Autologous CAR-T cells; Fludarabine; Cyclophosphamide,BIOLOGICAL; DRUG; DRUG,2020-08-01,2025-12-31,2026-12-31,China,Shanghai Pudong Hospital,TEAEs; TRAEs; AESIs,The primary purpose of this study is to determine the safety and efficacy of novel autologous CAR-T cells in patients with hematopoietic and lymphoid malignancies.,CD123
NCT03631576,CD123/CLL1 CAR-T Cells for R/R AML (STPHI_0001),CD123/CLL1 CAR-T Cell Therapy for Relapsed and Refractory Acute Myeloid Leukemia,UNKNOWN,"PHASE2, PHASE3",INTERVENTIONAL,20,Relapsed/Refractory AML,CD123/CLL1 CAR-T Cells,BIOLOGICAL,2018-08-10,2021-08-10,2021-08-10,China,Fujian Medical University,Leukemia free survival,The treatment options for relapse/refractory B-cell acute myeloid leukemia(AML)are limited.CD123/CLL1 CAR-T Cells may have a permanent anti-tumor effect and became very attractive. This study aims to assess the safety and toxicity of CD123/CLL1 CAR-T Cells to patients with relapse/refractory AML.,CD123; CLL-1
NCT07464951,CART123 Cells With or Without Ruxolitinib in Relapsed/Refractory Acute Myeloid Leukemia,Phase 1 Trial of Autologous CD123-Directed CAR T-Cells (CART123) as Monotherapy or in Combination With Ruxolitinib in Relapsed/Refractory Acute Myeloid Leukemia,NOT_YET_RECRUITING,PHASE1,INTERVENTIONAL,30,Acute Myeloid Leukemia (AML),Anti-CD123 LV redirected T cells (CART123); Ruxolitinib (JAKAVI®),BIOLOGICAL; DRUG,2026-04-01,2029-04-30,2030-04-30,United States,Stephan Grupp MD PhD,Evaluate the Safety of CART123; Safety of CART123 in combination with Ruxolitinib; Determine Maximum Tolerated Dose of CART123,This study is designed to evaluate the safety and effectiveness of CART123 cells either alone or when combined with ruxolitinib in pediatric and young adult subjects with relapsed or refractory AML. Subjects will be enrolled into one of two treatment cohorts: subjects who will receive CART123 alone (Cohort A) or subjects who will receive CART123 in combination with ruxolitinib (Cohort B).,CD123
NCT04272125,Safety and Efficacy of CD123-Targeted CAR-T Therapy for Relapsed/Refractory Acute Myeloid Leukemia,Safety and Efficacy of CD123-Targeted CAR-T Therapy for Relapsed/Refractory Acute Myeloid Leukemia,UNKNOWN,"PHASE1, PHASE2",INTERVENTIONAL,40,"Leukemia; Leukemia, Myeloid; Leukemia, Myeloid, Acute",CD123 CAR-T cells,BIOLOGICAL,2019-12-01,2023-12-31,2024-07-01,China,"Chongqing Precision Biotech Co., Ltd",Adverse events that related to treatment; The response rate of CD123 CAR-T treatment in patients with relapse/refractory Acute Myeloid Leukemia that treatment by CD123 CAR-T cells therapy,This is a single arm study to evaluate the efficacy and safety of CD123-targeted CAR-T cells therapy for patients with relapsed/refractory Acute Myeloid Leukemia.,CD123
NCT05457010,Phase I Study of Cell Therapies for the Treatment of Patients With Relapsed or Refractory AML or High-risk MDS,"Master Protocol for the Phase 1 Study of Cell Therapies for the Treatment of Patients With Relapsed or Refractory Acute Myeloid Leukemia or High-risk Myelodysplastic Syndrome, Including Long-term Safety Follow-up",UNKNOWN,PHASE1,INTERVENTIONAL,24,Acute Myeloid Leukemia; Myelodysplastic Syndromes,SPRX002; ARC-T Cells,BIOLOGICAL; BIOLOGICAL,2022-11-28,2025-09-30,2025-11-17,United States,"Arcellx, Inc.","Incidence of treatment-emergent adverse events (TEAEs), including dose-limiting toxicities (DLTs) and establish recommended Phase II dose (RP2D)",The purpose of this study is to evaluate the safety and preliminary activity of ARC-T cells and SPRX002 in participants with relapsed or refractory acute myeloid leukemia (AML) or high-risk myelodysplastic syndrome (MDS),CD123
NCT03190278,Study Evaluating Safety and Efficacy of UCART123v1.2 in Patients With Relapsed/Refractory Acute Myeloid Leukemia,"Phase I, Open Label Dose Escalation and Dose-Expansion Study to Evaluate the Safety, Expansion, Persistence, and Clinical Activity of UCART123 (Allogeneic Engineered T-cells Expressing Anti-CD123 Chimeric Antigen Receptor), Administered in Patients With Relapsed/Refractory Acute Myeloid Leukemia",ACTIVE_NOT_RECRUITING,PHASE1,INTERVENTIONAL,29,Relapsed/Refractory Acute Myeloid Leukemia,UCART123v1.2,BIOLOGICAL,2017-06-19,2024-12-24,2025-12,United States,Cellectis S.A.,Incidence of adverse events (AE)/serious adverse events (SAE)/Dose Limiting Toxicities (DLT) [Safety and Tolerability]; Dose escalation and expansion part: Occurrence of DLTs,"Phase I, open-label, dose-escalation and dose-expansion study evaluating the safety and efficacy of Universal Chimeric Antigen Receptor T-cell (UCART) targeting the Cluster of Differentiation 123 (CD123) in patients with relapsed/refractory acute myeloid leukemia (AML). The purpose of this study is to evaluate the safety and clinical activity of Universal Chimeric Antigen Receptor T-cells targeting CD123 (UCART123v1.2) and determine the Maximum Tolerated Dose (MTD) and Recommended Phase 2 Dose (RP2D).",CD123
NCT04678336,CD123 Redirected T Cells for AML in Pediatric Subjects,Phase 1 Study of Lentivirally Transduced T Cells Engineered to Contain Anti-CD123 Linked to TCRζ and 4-1BB Signaling Domains in Pediatric Subjects With Refractory or Relapsed Acute Myeloid Leukemia,TERMINATED,PHASE1,INTERVENTIONAL,12,"Acute Myeloid Leukemia, in Relapse; Acute Myeloid Leukemia, Pediatric; Acute Myeloid Leukemia, Refractory",CART123 cells; cyclophosphamide; fludarabine,BIOLOGICAL,2021-04-02,2025-05-09,2025-05-09,United States,University of Pennsylvania,Evaluate the safety of CART123 in AML subjects,"Phase 1 open-label study to evaluate the safety of intravenously administered, lentivirally transduced T cells expressing anti-CD123 chimeric antigen receptors expressing tandem TCRζ and 4-1BB (TCRζ /4-1BB) costimulatory domains in pediatric subjects with relapsed/refractory Acute Myeloid Leukemia (AML).",CD123
NCT07201727,CD123+CLL-1 CAR-T Sequential Infusion With CD7 CAR-T and Bridging to Allo-HSCT for Relapsed/Refractory Acute Myeloid Leukemia,Early Clinical Study of CD123+CLL-1 Dual-target CAR-T Cells Sequential Infusion CD7 CAR-T Cells and Bridging to Allogeneic Hematopoietic Stem Cell Transplantation for the Treatment of Relapsed and Refractory Acute Myeloid Leukemia,NOT_YET_RECRUITING,EARLY_PHASE1,INTERVENTIONAL,10,AML - Acute Myeloid Leukemia,CD123+CLL-1 dual-target CAR-T cells sequential infusion CD7 CAR-T cells and bridging to allogeneic,BIOLOGICAL,2025-09-30,2028-05-01,2028-07-01,,"Institute of Hematology & Blood Diseases Hospital, China",Monitor and record adverse events,"This study is a single-arm, open-label, prospective clinical trial, with patients suffering from refractory and relapsed acute myeloid leukemia as the subjects. It plans to enroll 10 cases to evaluate the safety and efficacy of sequential CD123+CLL-1 CAR-T cells followed by CD7 CAR-T cells treatment.",CD123; CLL-1
NCT03585517,Safety and Efficacy Evaluation of IM23 CAR-T Cells (IM23CAR-T),Safety and Efficacy Evaluation of IM23 CAR-T Cells On CD123+ AML Patients,COMPLETED,PHASE1,INTERVENTIONAL,10,AML,IM23,DRUG,2018-07-21,2020-08-01,2020-10-01,China,"Beijing Immunochina Medical Science & Technology Co., Ltd.",Occurrence of study related adverse events,Assessment of the Safety and Feasibility of Administering T Cells Expressing an Anti-CD123 Chimeric Antigen Receptor to Patients With CD123+ AML,CD123
NCT03556982,CART-123 FOR Relapsed/Refractory Acute Myelocytic Leukemia（AML）,CD123-Targeted CAR-T in Treating Patients With Relapsed/Refractory Acute Myelocytic Leukemia（AML）,UNKNOWN,"PHASE1, PHASE2",INTERVENTIONAL,10,"Leukemia, Myeloid, Acute",CART-123 cells,BIOLOGICAL,2018-03-01,2019-03-01,2020-03-01,China,The Affiliated Hospital of the Chinese Academy of Military Medical Sciences,Dose-limiting toxicity; Incidence of adverse events as assessed; Disease response (CR or CRi),The purpose of this study is to evaluate the safety and efficiency of CD123-Targeted CAR-T in Treating Patients with relapsed/refractory AML,CD123
NCT04599543,IL3 CAR-T Cell Therapy for Patients With CD123 Positive Relapsed and/or Refractory Acute Myeloid Leukemia,Clinical Trial for the Safety and Efficacy of IL3 CAR-T Cell Therapy for Patients With CD123 Positive Relapsed and/or Refractory Acute Myeloid Leukemia,NOT_YET_RECRUITING,EARLY_PHASE1,INTERVENTIONAL,36,Acute Myeloid Leukemia,IL3 CAR T-cells,DRUG,2020-11-15,2023-11-15,2026-11-15,China,Zhejiang University,Dose-limiting toxicity (DLT); Incidence of treatment-emergent adverse events (TEAEs),A Study of IL3 CAR-T Cell Therapy for Patients With CD123 Positive Relapsed and/or Refractory Acute Myeloid Leukemia.,CD123
NCT06125652,Administration of Anti Tim-3/CD123 CAR-T Cell Therapy in Relapsed and Refractory Acute Myeloid Leukemia (rr/AML),Application of Anti Tim-3/CD123 CAR-T Cell Therapy in Relapsed and Refractory Acute Myeloid Leukemia (rr/AML),RECRUITING,"PHASE1, PHASE2",INTERVENTIONAL,20,"Acute Myeloid Leukemia Refractory; Acute Myeloid Leukemia, in Relapse",anti Tim-3/CD123 CAR-T cell therapy,DRUG,2023-11-04,2026-01-01,2027-01-01,China,Xuzhou Medical University,Dose-limiting toxicity #DLT#,To evaluate the safety and efficacy of anti Tim3/CD123 CAR-T cells in the treatment of relapsed and refractory acute myeloid leukemia.,CD123
NCT03796390,Study Evaluating Safety and Efficacy of CAR-T Cells Targeting CD123 in Patients With Acute Myelocytic Leukemia,Study Evaluating Safety and Efficacy of CAR-T Cells Targeting CD123 in Patients With Acute Myelocytic Leukemia,UNKNOWN,PHASE1,INTERVENTIONAL,15,Acute Myelocytic Leukemia,CD123 CAR-T cells,BIOLOGICAL,2018-12-26,2020-11-06,2021-06-06,China,"Hebei Senlang Biotechnology Inc., Ltd.",Tumor load,"This is an open, single-arm, phase I clinical study to evaluate efficacy and safety of chimeric antigen receptor T cell immunotherapy (CAR-T) targeting CD123 in the treatment of Acute Myelocytic Leukemia. A total of 15 patients are planned to be enrolled following up one year.",CD123
NCT06765876,CART123 T Cells in Relapsed or Refractory CD123+ Hematologic Malignancies: A Dose Escalation Phase I Trial,"Safety and Efficacy of Anti-CD123 Chimeric Antigen Receptor-Modified Autologous T Cells (CART123) in Patients With Relapsed/Refractory CD123+ Hematologic Malignancies: A Dose Escalation, Open-Label, Phase I Study",RECRUITING,EARLY_PHASE1,INTERVENTIONAL,18,"Leukemia, Myeloid, Acute(AML); Precursor Cell Lymphoblastic Leukemia-Lymphoma; Myelodysplastic Syndromes (MDS); Blastic Plasmacytoid Dendritic Cell Neoplasm (BPDCN)",Autologous CAR123 T lymphocytes,BIOLOGICAL,2024-10-23,2028-12-31,2028-12-31,Czechia,"Institute of Hematology and Blood Transfusion, Czech Republic",Safety and tolerability of autologous CART123 cells; Rate of hematological recovery; A dose of CART123 cells for further study,"Adult patients with refractory or relapsed CD123+ hematologic malignancies, including acute myeloid leukemia, myelodysplastic syndrome, acute lymphoblastic leukemia, or blastic plasmocytoid dentritic cell neoplasm will be recruited in the trial. CART123 cells will be manufatured from blood of each patient. During the production of CAR123 cells, patients may receive appropriate bridging therapy. After cells are produced, participants will undergo a single course of lymphodepleting chemotherapy and receive a single dose of CAR123 T cells. The trial will establish the recommended dose for further",CD123
NCT02623582,CD123 Redirected Autologous T Cells for AML,Pilot Study of RNA-Redirected Autologous T Cells Engineered to Contain Anti-CD123 Linked to TCR and 4-1BB Signaling Domains in Patients With Refractory or Relapsed Acute Myeloid Leukemia,TERMINATED,EARLY_PHASE1,INTERVENTIONAL,7,Relapsed or Refractory Acute Myeloid Leukemia,Autologous Anti-CD 123 CAR TCR/4-1BB-expressing T-lymphocytes; Cyclophosphamide,BIOLOGICAL; DRUG,2015-12,2016-08-26,2016-11-18,United States,University of Pennsylvania,Number of Adverse Events,"Pilot open-label study to estimate the feasibility, safety and efficacy of intravenously administered, RNA electroporated autologous T cells expressing anti-CD123 chimeric antigen receptors expressing tandem TCR and 4-1BB (TCR /4-1BB) costimulatory domains (referred to as RNA CART123) in Acute Myeloid Leukemia (AML) subjects.",CD123
NCT04106076,Phase I Study of UCART123 in Patient With Adverse Genetic Risk Acute Myeloid Leukemia,"Phase I, Open Label Dose-escalation Study to Evaluate the Safety, Expansion, Persistence and Clinical Activity of Multiple Infusions of UCART123 (Allogeneic Engineered T-cells Expressing Anti-CD123 Chimeric Antigen Receptor) in Patients With Adverse Genetic Risk Acute Myeloid Leukaemia",WITHDRAWN,PHASE1,INTERVENTIONAL,0,Acute Myeloid Leukaemia,UCART123,BIOLOGICAL,2019-07-11,2019-12-05,2019-12-05,,Cellectis S.A.,Incidence of AE/SAE/DLT [Safety and Tolerability],"This is a Phase I, open-label, dose escalation study of UCART123 administered intravenously to patients with newly diagnosed CD123 positive adverse genetic risk acute myeloid leukaemia (AML) defined in the ELN adverse genetic risk group (2017). The purpose of this study is to evaluate the safety and clinical activity of multiple infusions of UCART123 and to determine the Maximum Tolerated Dose (MTD).",CD123
NCT03114670,Donor-derived Anti-CD123-CART Cells for Recurred AML After Allo-HSCT,Donor-derived Anti-CD123 Chimeric Antigen Receptors Modified T Cells for Recurred Acute Myeloid Leukaemia After Allogeneic Hematopoietic Stem Cell Transplantation,UNKNOWN,PHASE1,INTERVENTIONAL,20,Adult Acute Myeloid Leukemia,CD123CAR-41BB-CD3zeta-EGFRt-expressing T cells,BIOLOGICAL,2017-03-25,2019-03-18,2021-03-18,China,Affiliated Hospital to Academy of Military Medical Sciences,Incidence of adverse events related to treatment as assessed by NCI CTCAE version 4.03,Patients with acute myeloid leukemia(AML) recurred after the allogeneic hematopoietic stem cell transplantation (allo-HSCT) have a dismal prognosis.The investigators developed donor-derived chimeric antigen receptor modified-T cell(CART) to target CD123 for the treatment of AML. The investigators start the Phase I study aimed to treat recurred post-transplantation AML patients using donor-derived CAR-T. The purpose of this study is to assess the safety and effectiveness of anti-CD123 CAR-T cells in patients.,CD123
NCT07432100,"Clinical Study on the Safety, Efficacy and Pharmacokinetics of Universal CLL1 Chimeric Antigen Receptor T-Cell in Relapsed/Refractory Acute Myeloid Leukemia","Clinical Study on the Safety, Efficacy and Pharmacokinetics of Universal CLL1 Chimeric Antigen Receptor T-Cell in Relapsed/Refractory Acute Myeloid Leukemia",NOT_YET_RECRUITING,PHASE1,INTERVENTIONAL,20,Acute Myeloid Leukemia; Chimeric Antigen Receptor T-cell; Universal CLL1 CAR-T,universal CLL1 CAR-T cells,BIOLOGICAL,2026-02,2028-12,2028-12-12,,Mingfeng Zhao,Bone marrow tumor burden; Overall survival time; Progression-Free-Survival,"Acute myeloid leukemia (AML) is a common type of acute leukemia in adults. Although the treatment of AML has improved in recent decades, the 5-year survival rate remains below 50% due to the chemoresistance or toxicity of these treatments. Most patients eventually die from relapse and/or progressive disease, and these patients urgently need new treatment strategies. Chimeric antigen receptor T-cell (CAR-T cell) therapy is an adoptive immunotherapy that expresses one or more specific chimeric antigen receptors (CARs) on T cells through genetic engineering, enabling them to target tumor cells. C",CLEC12A; CLL-1
NCT06128044,CRISPR-Edited Allogeneic Anti-CLL-1 CAR-T Cell Therapy in Patients With Relapsed/Refractory Acute Myeloid Leukemia,"A Phase 1, Multicenter, Open-Label Study of CB-012, a CRISPR-Edited Allogeneic Anti-CLL-1 CAR-T Cell Therapy in Patients With Relapsed/Refractory Acute Myeloid Leukemia",TERMINATED,PHASE1,INTERVENTIONAL,12,"Acute Myeloid Leukemia, in Relapse; Acute Myeloid Leukemia Refractory",CB-012,DRUG,2024-02-08,2025-05-30,2025-05-30,United States,"Caribou Biosciences, Inc.",(Part A) Number of patients with dose limiting toxicities (DLT); (Part B) Overall Response Rate (ORR),"CB-012 is an allogeneic chimeric antigen receptor (CAR-T) cell therapy that targets C-type lectin-like molecule-1 (CLL-1). This is a Phase 1 study to evaluate the safety, preliminary efficacy, and pharmacokinetics, of CB-012 (the study treatment) in adults with acute myeloid leukemia (AML) that has come back after prior treatment (relapsed) or did not respond or is no longer responding to other treatment (refractory). Participants must have received at least 1 but not more than 3 prior lines of treatment for AML .",CLEC12A; CLL-1
NCT06017258,A Study of CD371-YSNVZIL-18 CAR T Cells in People With Acute Myeloid Leukemia,Phase I Trial of CLEc12a (CD371) Targeted ArmoRed Immune Effector Cells in Patients With Relapsed/Refractory Acute Myeloid Leukemia (CLEAR-AML),RECRUITING,PHASE1,INTERVENTIONAL,15,"Refractory Acute Myeloid Leukemia; Relapsed Acute Myeloid Leukemia; Acute Myeloid Leukemia; Acute Myeloid Leukemia, in Relapse; Acute Myeloid Leukemia Refractory",CD371-specific/YSNVz/I-18 CAR T cells,BIOLOGICAL,2023-08-22,2026-08-22,2026-08-22,United States,Memorial Sloan Kettering Cancer Center,Maximum Tolerated Dose (MTD) of CAR T cells,"The purpose of this study is to find out whether CD371-YSNVZ-IL18 CAR T cells are safe, and to look for the highest dose of CD371-YSNVZ-IL18 CAR T cells that cause few or mild side effects in participants.",CLEC12A; CLL-1
NCT07342244,Safety and Efficacy of CLL1 CAR-T Followed by Allogeneic Hematopoietic Stem Cell Transplantation in the Treatment of Relapsed/Refractory Acute Myeloid Leukemia,Safety and Efficacy of CLL1 CAR-T Followed by Allogeneic Hematopoietic Stem Cell Transplantation in the Treatment of Relapsed/Refractory Acute Myeloid Leukemia,NOT_YET_RECRUITING,NA,INTERVENTIONAL,18,AML; AML (Acute Myeloid Leukemia),CLL1 CAR-T Cell Sequential Allogeneic Hematopoietic Stem Cell Transplantation,DRUG,2026-01-30,2028-12-20,2029-12-20,China,Donghua Zhang,Overall survival,"This study aims to evaluate whether an innovative combination therapy (CLL1 CAR-T sequential allogeneic hematopoietic stem cell transplantation) is safe, feasible and effective for the treatment of relapsed/refractory acute myeloid leukemia (R/R AML).",CLL-1
NCT06347458,BG1805 Injection in the Treatment of Relapsed or Refractory Acute Myeloid Leukemia in Children,"A Single-arm, Dose-escalation and Dose-expansion Phase I Clinical Study to Evaluate the Tolerability, Safety and Preliminary Efficacy of BG1805 Injection in the Treatment of Relapsed or Refractory Acute Myeloid Leukemia in Children",NOT_YET_RECRUITING,PHASE1,INTERVENTIONAL,24,Leukemia; Acute Myeloid Leukemia,BG1805,BIOLOGICAL,2024-04,2027-04,2027-08,,"Guangzhou Bio-gene Technology Co., Ltd",1.Dose Limited Toxicity Rate; 2.Incidence of Treatment-Emergent Adverse Events,"This is a single-arm, single-dose dose-escalation and dose-expansion study.",CLL-1
NCT05252572,Clinical Study of CLL1 CAR-T Cells in the Treatment of Hematological Malignancies,Clinical Study on the Safety and Effectiveness of CLL1 CAR-T Cells in the Treatment of CLL1-positive Hematological Malignancies,UNKNOWN,EARLY_PHASE1,INTERVENTIONAL,36,AML,CLL1 CAR T-cells,BIOLOGICAL,2022-02-28,2024-11-30,2024-11-30,China,Zhejiang University,Dose-limiting toxicity (DLT); Incidence of treatment-emergent adverse events (TEAEs),Clinical Study on the Safety and Effectiveness of CLL1 CAR-T Cells in the Treatment of CLL1-positive Hematological Malignancies,CLL-1
NCT06880354,A Clinical Study to Evaluate the Safety and Efficacy of CLL1 and CD38 Dual-Target CAR-T Cell Injection in the Treatment of Relapsed or Refractory Acute Myeloid Leukemia,A Clinical Study to Evaluate the Safety and Efficacy of CLL1 and CD38 Dual-Target CAR-T Cell Injection in the Treatment of Relapsed or Refractory Acute Myeloid Leukemia,RECRUITING,PHASE1,INTERVENTIONAL,37,Acute Myeloid Leukemia,CLL1 and CD38 Dual-Target CAR-T Cell Injection,DRUG,2025-05-22,2028-03-31,2028-03-31,China,"Institute of Hematology & Blood Diseases Hospital, China",Dose-Limiting Toxicity (DLT) Rate; Adverse Events （AEs）,"This is a single-arm, open-label, phase I dose-escalation clinical study to evaluate the safety and preliminary efficacy of CLL1 and CD38 dual-target CAR T cell injection in r/r AML subjects.",CLL-1; CD38
NCT04219163,Chimeric Antigen Receptor T-cells for The Treatment of AML Expressing CLL-1 Antigen,Chimeric Antigen Receptor T-cells for The Treatment of Acute Myeloid Leukemia Expressing CLL-1 Antigen,ACTIVE_NOT_RECRUITING,PHASE1,INTERVENTIONAL,18,Acute Myeloid Leukemia,CLL-1.CAR T cells,BIOLOGICAL,2020-07-09,2025-03-24,2038-07-31,United States,Baylor College of Medicine,Dose limiting toxicity (DLT) rate,"Patients eligible for this study have a type of blood cancer Acute Myeloid Leukemia (AML) which has come back or has not gone away after treatment.

The body has different ways of fighting disease and infection, and this research study combines two different ways of fighting cancer with antibodies and T cells with the hope that they will work together. T cells (also called T lymphocytes) are special infection-fighting blood cells that can kill other cells including tumor cells. Antibodies are types of proteins that protect the body from bacterial and other infectious diseases. Both antibodies ",CLL-1
NCT04789408,Study of KITE-222 in Participants With Relapsed/Refractory Acute Myeloid Leukemia,"A Phase 1 Open-label, Multicenter Study Evaluating the Safety of KITE-222, an Autologous Anti-CLL-1 CAR T-cell Therapy, in Subjects With Relapsed/Refractory Acute Myeloid Leukemia",TERMINATED,PHASE1,INTERVENTIONAL,15,Acute Myeloid Leukemia,Cyclophosphamide; Fludarabine; KITE-222,DRUG; DRUG; BIOLOGICAL,2021-07-19,2024-05-18,2024-05-18,France; United States,"Kite, A Gilead Company",Percentage of Participants Who Experienced Dose Limiting Toxicities (DLTs),"The goal of this clinical study is to learn more about the safety and dosing of the study drug, KITE-222, in participants with relapsed/refractory (r/r) acute myeloid leukemia (AML).",CLL-1
